{
  "artifact_kind": "triage_regime_table",
  "claim_grade": "control",
  "claim_id": "P1.benchmark_suite.phase1_parity",
  "code_version": "8e3aba29afd9656ef69a5c2cc88d449cf36411e1",
  "config_hash": "97e5ca6cbe469248204443774123f10fb3c1bc3b65b8f9cea60cfd554e118e89",
  "evidence_type": "exact_rational",
  "nonclaims": [
    "Phase 1 benchmark parity is a control suite, not a standalone GT4 triage certificate.",
    "Dedicated GT4 regime-table promotion, if present, is filed in a separate artifact."
  ],
  "payload": {
    "artifact_status": "phase1_benchmark_parity",
    "benchmarks": [
      {
        "benchmark": "flat_control",
        "current_quotient_size": 1,
        "currentization_status": "skipped",
        "discrepancy_metric_value": "0/1",
        "exact_max_abs_future_gap": "0/1",
        "flattening_status": "skipped",
        "history_count": 2,
        "interface": "mid",
        "loop_action_score_current_quotient": "0/1",
        "loop_action_score_predictive_quotient": "0/1",
        "max_fiber_size": 1,
        "predictive_quotient_size": 1,
        "regime": "flat",
        "robustness_fraction": "1/1",
        "robustness_predicate_name": "flat_control_cleared",
        "robustness_threshold": 0.95,
        "support_fixation_status": "skipped",
        "witness_count": 0
      },
      {
        "benchmark": "protocol_trap_naive",
        "current_quotient_size": 1,
        "currentization_status": "skipped",
        "discrepancy_metric_value": "1/1",
        "exact_max_abs_future_gap": "1/1",
        "flattening_status": "skipped",
        "history_count": 2,
        "interface": "mid",
        "loop_action_score_current_quotient": "0/1",
        "loop_action_score_predictive_quotient": "0/1",
        "max_fiber_size": 2,
        "predictive_quotient_size": 2,
        "regime": "artifact_trap",
        "robustness_fraction": "1/1",
        "robustness_predicate_name": "protocol_trap_naive_persists",
        "robustness_threshold": 0.8,
        "support_fixation_status": "ok",
        "witness_count": 1
      },
      {
        "benchmark": "protocol_trap_honest",
        "current_quotient_size": 2,
        "currentization_status": "skipped",
        "discrepancy_metric_value": "0/1",
        "exact_max_abs_future_gap": "0/1",
        "flattening_status": "skipped",
        "history_count": 2,
        "interface": "mid",
        "loop_action_score_current_quotient": "0/1",
        "loop_action_score_predictive_quotient": "0/1",
        "max_fiber_size": 1,
        "predictive_quotient_size": 2,
        "regime": "flat",
        "robustness_fraction": "1/1",
        "robustness_predicate_name": "protocol_trap_honest_cleared",
        "robustness_threshold": 0.95,
        "support_fixation_status": "ok",
        "witness_count": 0
      },
      {
        "benchmark": "flattenable_raw",
        "current_quotient_size": 1,
        "currentization_status": "skipped",
        "discrepancy_metric_value": "1/1",
        "exact_max_abs_future_gap": "1/1",
        "flattening_status": "passed",
        "history_count": 2,
        "interface": "mid",
        "loop_action_score_current_quotient": "0/1",
        "loop_action_score_predictive_quotient": "0/1",
        "max_fiber_size": 2,
        "predictive_quotient_size": 2,
        "regime": "flattenable",
        "robustness_fraction": "1/1",
        "robustness_predicate_name": "flattenable_raw_persists",
        "robustness_threshold": 0.8,
        "support_fixation_status": "ok",
        "witness_count": 1
      },
      {
        "benchmark": "flattenable_completed",
        "current_quotient_size": 1,
        "currentization_status": "skipped",
        "discrepancy_metric_value": "0/1",
        "exact_max_abs_future_gap": "0/1",
        "flattening_status": "skipped",
        "history_count": 2,
        "interface": "mid",
        "loop_action_score_current_quotient": "0/1",
        "loop_action_score_predictive_quotient": "0/1",
        "max_fiber_size": 1,
        "predictive_quotient_size": 1,
        "regime": "flat",
        "robustness_fraction": "1/1",
        "robustness_predicate_name": "flattenable_completed_cleared",
        "robustness_threshold": 0.95,
        "support_fixation_status": "ok",
        "witness_count": 0
      },
      {
        "benchmark": "latent_memory_base",
        "current_quotient_size": 1,
        "currentization_status": "passed",
        "discrepancy_metric_value": "1/1",
        "exact_max_abs_future_gap": "1/1",
        "flattening_status": "skipped",
        "history_count": 2,
        "interface": "mid",
        "loop_action_score_current_quotient": "0/1",
        "loop_action_score_predictive_quotient": "0/1",
        "max_fiber_size": 2,
        "predictive_quotient_size": 2,
        "regime": "explicit_latent",
        "robustness_fraction": "1/1",
        "robustness_predicate_name": "latent_memory_base_persists",
        "robustness_threshold": 0.8,
        "support_fixation_status": "ok",
        "witness_count": 1
      },
      {
        "benchmark": "latent_memory_refined",
        "current_quotient_size": 2,
        "currentization_status": "skipped",
        "discrepancy_metric_value": "0/1",
        "exact_max_abs_future_gap": "0/1",
        "flattening_status": "skipped",
        "history_count": 2,
        "interface": "mid",
        "loop_action_score_current_quotient": "0/1",
        "loop_action_score_predictive_quotient": "0/1",
        "max_fiber_size": 1,
        "predictive_quotient_size": 2,
        "regime": "flat",
        "robustness_fraction": "1/1",
        "robustness_predicate_name": "latent_memory_refined_cleared",
        "robustness_threshold": 0.95,
        "support_fixation_status": "ok",
        "witness_count": 0
      },
      {
        "benchmark": "dissipative_memory@mid",
        "current_quotient_size": 1,
        "currentization_status": "skipped",
        "discrepancy_metric_value": "1/1",
        "exact_max_abs_future_gap": "1/1",
        "flattening_status": "skipped",
        "history_count": 2,
        "interface": "mid",
        "loop_action_score_current_quotient": "0/1",
        "loop_action_score_predictive_quotient": "0/1",
        "max_fiber_size": 2,
        "predictive_quotient_size": 2,
        "regime": "dissipative",
        "robustness_fraction": "1/1",
        "robustness_predicate_name": "dissipative_memory_persists",
        "robustness_threshold": 0.8,
        "support_fixation_status": "skipped",
        "witness_count": 1
      },
      {
        "benchmark": "dissipative_memory@end",
        "current_quotient_size": 1,
        "currentization_status": "skipped",
        "discrepancy_metric_value": "0/1",
        "exact_max_abs_future_gap": "0/1",
        "flattening_status": "skipped",
        "history_count": 2,
        "interface": "end",
        "loop_action_score_current_quotient": "0/1",
        "loop_action_score_predictive_quotient": "0/1",
        "max_fiber_size": 1,
        "predictive_quotient_size": 1,
        "regime": "flat",
        "robustness_fraction": "1/1",
        "robustness_predicate_name": "dissipative_memory_end_cleared",
        "robustness_threshold": 0.95,
        "support_fixation_status": "skipped",
        "witness_count": 0
      },
      {
        "benchmark": "kovacs_wheel",
        "current_quotient_size": 1,
        "currentization_status": "skipped",
        "discrepancy_metric_value": "1/1",
        "exact_max_abs_future_gap": "1/1",
        "flattening_status": "skipped",
        "history_count": 2,
        "interface": "mid",
        "loop_action_score_current_quotient": "0/1",
        "loop_action_score_predictive_quotient": "1/1",
        "max_fiber_size": 2,
        "predictive_quotient_size": 2,
        "regime": "coherent_candidate",
        "robustness_fraction": "1/1",
        "robustness_predicate_name": "kovacs_wheel_persists",
        "robustness_threshold": 0.8,
        "support_fixation_status": "skipped",
        "witness_count": 1
      }
    ],
    "note": "Phase 1 benchmark-parity diagnostic; not an honesty-ledger-graded GT certificate."
  },
  "quantifier_domain": {
    "N_values": [],
    "epsilon_grid": [],
    "lens_catalog_hash": "7b822317a3466ce3e37574a69c5b7e355f2ec0317a3dcd03b24d5908581ba131",
    "model_families": [
      "toy_benchmarks"
    ],
    "protocol_catalog_hash": "97e5ca6cbe469248204443774123f10fb3c1bc3b65b8f9cea60cfd554e118e89"
  }
}