{
  "artifact_kind": "buyback_curve",
  "claim_grade": "theorem_audited_class",
  "claim_id": "GT5.buyback_curve.kovacs_moment.east_N10",
  "code_version": "8e3aba29afd9656ef69a5c2cc88d449cf36411e1",
  "config_hash": "46797c9aa07ba325e7952a5e0b55d1e6fc4bdddb515b96d38867f31110b5d8f7",
  "config_path": "configs/kovacs_hump_default.json",
  "evidence_type": "exact_rational",
  "nonclaims": [
    "buyback saturation or nonsaturation is not a GB5 repair-impossibility certificate; GB5 requires a separate exhaustive repair-class sweep",
    "the shipped Kovacs buyback curve is a minimal two-history witness with saturation_budget=1; it demonstrates buyback mechanics, not general single-scalar or TNM insufficiency",
    "Loss is exact in-carrier sum squared error; no held-out generalization claim."
  ],
  "payload": {
    "entry_weights": [
      "1/1"
    ],
    "envelope": {
      "0": "800667523906117556196744987600117010281872645915573449080184369343901444748419217056275043747144317630094073778175564680343058065381701258909720793778407169330886538207181823629211234562566925947384185277719506559083772503320195372000040597476923301810807792104994999416053331053585138226311878281040930034912899930683577857241954107420326899099435537398927495880272686112536806487969/39817812942136593658488104362699796661496627056741964563627841512167479835577531775077988801774416437918277904227549416458164530117176678238688388327370492978455497438404797984300439942353711731185263807507093268357416338154039242223615913726240134087669338370184185263168518705012167957485490458816800000000000000000000000000000000000000000000000000000000000000000000000000000000000000",
      "1": "0/1",
      "2": "0/1"
    },
    "history_weights": [
      "1/1",
      "1/1"
    ],
    "loss_definition": "sum of two squared errors under group-mean prediction",
    "raw_by_budget": {
      "0": [
        {
          "coordinates": [],
          "loss": "800667523906117556196744987600117010281872645915573449080184369343901444748419217056275043747144317630094073778175564680343058065381701258909720793778407169330886538207181823629211234562566925947384185277719506559083772503320195372000040597476923301810807792104994999416053331053585138226311878281040930034912899930683577857241954107420326899099435537398927495880272686112536806487969/39817812942136593658488104362699796661496627056741964563627841512167479835577531775077988801774416437918277904227549416458164530117176678238688388327370492978455497438404797984300439942353711731185263807507093268357416338154039242223615913726240134087669338370184185263168518705012167957485490458816800000000000000000000000000000000000000000000000000000000000000000000000000000000000000",
          "resolved": false
        }
      ],
      "1": [
        {
          "coordinates": [
            "T_f"
          ],
          "loss": "0/1",
          "resolved": true
        },
        {
          "coordinates": [
            "D"
          ],
          "loss": "0/1",
          "resolved": true
        },
        {
          "coordinates": [
            "n_1"
          ],
          "loss": "0/1",
          "resolved": true
        }
      ],
      "2": [
        {
          "coordinates": [
            "T_f",
            "D"
          ],
          "loss": "0/1",
          "resolved": true
        },
        {
          "coordinates": [
            "T_f",
            "n_1"
          ],
          "loss": "0/1",
          "resolved": true
        },
        {
          "coordinates": [
            "D",
            "n_1"
          ],
          "loss": "0/1",
          "resolved": true
        }
      ]
    },
    "resolved_coordinates": [
      [
        "T_f"
      ],
      [
        "D"
      ],
      [
        "n_1"
      ]
    ],
    "saturation_budget": 1
  },
  "quantifier_domain": {
    "N_values": [
      10
    ],
    "epsilon_grid": [
      "1/10",
      "1/5",
      "3/10",
      "2/5",
      "1/2",
      "3/5",
      "7/10"
    ],
    "lens_catalog_hash": "eacaa860b45121167fe2382aac912161df0d6a0d79b267d384dd6ae90f86916b",
    "model_families": [
      "east"
    ],
    "protocol_catalog_hash": "24d09e2d690888f2fc54121ba0ea0d4e0363071ea52871ab7092d634bce1f24f"
  }
}