{
  "artifact_kind": "witness_certificate",
  "claim_grade": "theorem_audited_class",
  "claim_id": "GT2.kovacs_moment.east_N10",
  "code_version": "961e58f6fa34aa9001a24745aac41e808ea8325a",
  "config_hash": "46797c9aa07ba325e7952a5e0b55d1e6fc4bdddb515b96d38867f31110b5d8f7",
  "config_path": "configs/kovacs_hump_default.json",
  "evidence_type": "exact_rational",
  "nonclaims": [
    "filed as P4 staged dependence, not a directionality or irreversibility claim"
  ],
  "payload": {
    "continuation_catalog_hash": "c7b16f51fb894abcf9760d92546e0862bdba5054070028fdee9b4c8d88a6d3dc",
    "diagnostics": {
      "current_quotient_size": 1,
      "exact_max_abs_future_gap_value": "894800270398996669970577146200742290598888783658739337715748248658604094847286938452174205902012894992520702349049002192506687405312559202064136251228070164407932467166932095241695887666265937/4461939765513234360524882911829997870871840499299445558695359708950291920937467562985037664397759197806117518640785959502036479752067268452823868480780000000000000000000000000000000000000000000",
      "history_count": 2,
      "max_fiber_size": 2,
      "predictive_quotient_size": 2,
      "witness_count": 1
    },
    "interface": "mid",
    "lens_id": "L_energy",
    "package_ref": "generated:kovacs_moment:east_N10:L_energy",
    "witness_pairs": [
      {
        "family": "W_kovacs_moment",
        "h_id": "mu_K",
        "hprime_id": "pi_eq",
        "s0_equal_entries": [
          {
            "event_id": "w_E",
            "value": "20/7"
          }
        ],
        "separating_entry": {
          "abs_gap": "894800270398996669970577146200742290598888783658739337715748248658604094847286938452174205902012894992520702349049002192506687405312559202064136251228070164407932467166932095241695887666265937/4461939765513234360524882911829997870871840499299445558695359708950291920937467562985037664397759197806117518640785959502036479752067268452823868480780000000000000000000000000000000000000000000",
          "continuation_id": "probe_hold",
          "event_id": "w_E",
          "value_h": "13643199600436809128613099751429307635947004495942869505416775988516581011811479975552281818467039174438570755608437457912610915268361897638703760482028070164407932467166932095241695887666265937/4461939765513234360524882911829997870871840499299445558695359708950291920937467562985037664397759197806117518640785959502036479752067268452823868480780000000000000000000000000000000000000000000",
          "value_hprime": "20/7"
        },
        "tuning": {
          "theta_star": "74623903468331926922607714866616379089043120787602253960817020076276933552098919102482369/2078302917726322243988997652720241917073617405512601274481815388366802822403693327801814839"
        }
      }
    ]
  },
  "quantifier_domain": {
    "N_values": [
      10
    ],
    "epsilon_grid": [
      "1/10",
      "1/5",
      "3/10",
      "2/5",
      "1/2",
      "3/5",
      "7/10"
    ],
    "lens_catalog_hash": "3d828d1670dd8a28b6a76fa65ffd897c15b2a8239c345010131251d698a73aef",
    "model_families": [
      "east"
    ],
    "protocol_catalog_hash": "24d09e2d690888f2fc54121ba0ea0d4e0363071ea52871ab7092d634bce1f24f"
  }
}